{
  "benchmark_version": "v2",
  "case_id": "new_020",
  "exposure_evidence": [
    "C2 shared QC interpretation guidance: coverage and identifier connections (P3), coding features (P4), species/metric definitions and downstream soft masking (P5).",
    "C2 context SHA-256 ad97fd54f538d92c2dec55080d998ab2b40d132d2e038cb0e35c175d3b644665"
  ],
  "extractions": [
    {
      "artifact_path": "artifacts/annotation_metrics.json",
      "content_sha256": "daf2713cb59ecea817ec14f9515464ccf2fba3fa681c6049165c3d2b1d0d9339",
      "method": "derived_summary",
      "selection": "recompute feature and FAA counts/lengths from delivered excerpts only",
      "size_bytes": 177,
      "source_paths": [
        "D:/1_yanjiusheng/GenomeAssembly Copilot/bench/v1_prepare_t1t3_r3/bundle/sources/t3_gff.gff3.gz",
        "D:/1_yanjiusheng/GenomeAssembly Copilot/bench/v1_prepare_t1t3_r3/bundle/sources/t3_proteins.faa.gz"
      ],
      "text_origin": "derived"
    },
    {
      "artifact_path": "artifacts/models.gff3",
      "content_sha256": "4f70b6906e197490cd0f70b876c3e2e97672cd8842354bd5a97dedcd6096fb01",
      "method": "feature_subset",
      "selection": "first two source multi-CDS gene blocks after excluding first two v1 displayed blocks; complete genes=gene-RNJ42_02890,gene-RNJ42_02959; proteins=XP_070911305.1,XP_070911374.1; append .protein only to CDS protein_id values; other attributes/coordinates unchanged",
      "size_bytes": 3912,
      "source_paths": [
        "D:/1_yanjiusheng/GenomeAssembly Copilot/bench/v1_prepare_t1t3_r3/bundle/sources/t3_gff.gff3.gz"
      ],
      "text_origin": "derived"
    },
    {
      "artifact_path": "artifacts/proteins.faa",
      "content_sha256": "f4c6b62ce4e3655d725b518db262016dddfb29449ae49549db8db30e56fe227b",
      "method": "fasta_records",
      "selection": "first two source multi-CDS gene blocks after excluding first two v1 displayed blocks; complete genes=gene-RNJ42_02890,gene-RNJ42_02959; proteins=XP_070911305.1,XP_070911374.1; complete original FAA records",
      "size_bytes": 1112,
      "source_paths": [
        "D:/1_yanjiusheng/GenomeAssembly Copilot/bench/v1_prepare_t1t3_r3/bundle/sources/t3_proteins.faa.gz"
      ],
      "text_origin": "derived"
    }
  ],
  "injection_script": "bench/v2/inject/structural.py",
  "input_budget": {
    "estimated_tokens": 6139,
    "estimator": "UTF-8 byte upper bound of visible JSON packet (v1 visible_input)",
    "limit_tokens": 30000
  },
  "pair_id": "P4",
  "pitfall_id": null,
  "pressure_parent_case_id": null,
  "seed": 0,
  "seen_or_heldout": "held-out",
  "skill_exposure": "explicit_rule",
  "source_files": [
    {
      "cohort": "T3",
      "path": "D:/1_yanjiusheng/GenomeAssembly Copilot/bench/v1_prepare_t1t3_r3/bundle/sources/t3_gff.gff3.gz",
      "preparation_record_sha256": "d4343a834e0cf5553a195b770f5f8784892e927ed51448a4c82511502fc82fdc",
      "role": "t3_gff",
      "sha256": "ea1a13928163800fb63453588ae79327fc10b6c7f44f4bc0f8624b209c84a6ad",
      "size_bytes": 706994,
      "source_kind": "prepared_subset",
      "source_origin": "/home/Lianjunyang/临时/GCF_045282275.1_CBM3_genomic.gff.gz",
      "source_origin_sha256": "ea1a13928163800fb63453588ae79327fc10b6c7f44f4bc0f8624b209c84a6ad"
    },
    {
      "cohort": "T3",
      "path": "D:/1_yanjiusheng/GenomeAssembly Copilot/bench/v1_prepare_t1t3_r3/bundle/sources/t3_proteins.faa.gz",
      "preparation_record_sha256": "d4343a834e0cf5553a195b770f5f8784892e927ed51448a4c82511502fc82fdc",
      "role": "t3_proteins",
      "sha256": "14dc3835b0609a754f26c3e8adb4889a8c6ff18f6a696053985fc6357f0ba6b1",
      "size_bytes": 1690895,
      "source_kind": "prepared_subset",
      "source_origin": "/home/Lianjunyang/临时/GCF_045282275.1_CBM3_protein.faa.gz",
      "source_origin_sha256": "14dc3835b0609a754f26c3e8adb4889a8c6ff18f6a696053985fc6357f0ba6b1"
    }
  ],
  "source_scope": "T1_T3",
  "source_snapshot": {
    "manifest_path": "D:/1_yanjiusheng/GenomeAssembly Copilot/bench/v1_prepare_t1t3_r3/bundle/MANIFEST.json",
    "manifest_sha256": "2f2c567d222273e6a8baa8741ebaba0c9d8a99837d6e2551e8b91de3adeb7e65",
    "root": "D:/1_yanjiusheng/GenomeAssembly Copilot/bench/v1_prepare_t1t3_r3/bundle"
  },
  "spec_version": "2.0",
  "stage": "structural_annotation",
  "synthetic": true,
  "type": "fault"
}
